{
  "$schema": "http://json-schema.org/draft-07/schema#",
  "$id": "https://ai.rhyslindmark.com/givebetter/open-botec/template.schema.json",
  "title": "Open BOTEC intervention template",
  "description": "An intervention archetype: one formula, with every parameter labeled universal (literature, reused everywhere), local (geography-specific lookups), org (the organization's own reported data) or convention (modeling choices). Universal and convention values live here. Local and org values live in parameters/<geoId>/<archetypeId>.json or in an estimate recipe. Formulas use the restricted expression grammar in agents.md: numbers, parameter names, + - * / ^ ( ), and exp, log, min, max.",
  "type": "object",
  "additionalProperties": false,
  "required": ["schemaVersion", "archetypeId", "version", "name", "appliesWhen", "nativeOutcome", "costDenominator", "formulas", "parameters"],
  "properties": {
    "schemaVersion": { "const": "open-botec-template/0.1" },
    "archetypeId": { "type": "string", "pattern": "^[a-z0-9-]+$" },
    "version": { "type": "string", "pattern": "^v[0-9]+(\\.[0-9]+)*$" },
    "name": { "type": "string" },
    "causeArea": { "type": "string", "description": "Search facet, e.g. overdose, chronic-disease, healthy-aging, housing." },
    "appliesWhen": { "type": "array", "items": { "type": "string" }, "minItems": 1 },
    "doesNotApplyWhen": { "type": "array", "items": { "type": "string" } },
    "nativeOutcome": {
      "type": "object",
      "additionalProperties": false,
      "required": ["unit"],
      "properties": { "unit": { "type": "string" }, "notes": { "type": "string" } }
    },
    "costDenominator": {
      "type": "object",
      "additionalProperties": false,
      "required": ["unit", "costParameter"],
      "properties": {
        "unit": { "type": "string", "description": "What one unit of cost buys, e.g. 'naloxone dose distributed'." },
        "costParameter": { "type": "string", "description": "Name of the parameter (or derived quantity) holding USD per unit." }
      }
    },
    "derived": {
      "type": "object",
      "description": "Named intermediate expressions, evaluated in order, available to later expressions and formulas.",
      "additionalProperties": { "type": "string" }
    },
    "formulas": {
      "type": "object",
      "additionalProperties": false,
      "required": ["nativeOutcomesPerUnit"],
      "properties": {
        "nativeOutcomesPerUnit": { "type": "string", "description": "Native outcomes produced per unit of the cost denominator at the margin." },
        "qalyBridge": {
          "type": "object",
          "additionalProperties": false,
          "required": ["bridgeId", "version", "qalysPerNativeOutcome"],
          "properties": {
            "bridgeId": { "type": "string" },
            "version": { "type": "string" },
            "qalysPerNativeOutcome": { "type": "string" },
            "notes": { "type": "string" }
          }
        }
      }
    },
    "parameters": {
      "type": "object",
      "minProperties": 1,
      "additionalProperties": {
        "type": "object",
        "additionalProperties": false,
        "required": ["scope", "label", "unit"],
        "properties": {
          "scope": { "enum": ["universal", "local", "org", "convention"] },
          "label": { "type": "string" },
          "unit": { "type": "string" },
          "default": { "$ref": "botec.schema.json#/$defs/input", "description": "Required for universal and convention parameters. Local/org parameters must not carry a default, so a missing lookup fails loudly instead of silently inheriting San Francisco." },
          "lookup": {
            "type": "object",
            "additionalProperties": false,
            "description": "How a localizing agent finds this value in a new geography.",
            "properties": {
              "preferredSources": { "type": "array", "items": { "type": "string" } },
              "fallback": { "type": "string" },
              "judgmentGuide": { "type": "string", "description": "For judgment parameters: the anchors the SF author used, so another geography's judgment is comparable." }
            }
          }
        },
        "allOf": [
          { "if": { "properties": { "scope": { "enum": ["universal", "convention"] } } }, "then": { "required": ["default"] } },
          { "if": { "properties": { "scope": { "enum": ["local", "org"] } } }, "then": { "not": { "required": ["default"] } } }
        ]
      }
    },
    "excludedEffects": { "type": "array", "items": { "type": "string" } },
    "nullBoundary": { "type": "string" },
    "origin": {
      "type": "object",
      "additionalProperties": false,
      "properties": {
        "factoredFrom": { "type": "string", "description": "Legacy model path." },
        "reproduces": { "type": "string", "description": "What the template reproduces exactly from the legacy model and what it changes." }
      }
    }
  }
}
